{
  "$schema": "https://ui.logic2b.com/schema.json",
  "style": "default",
  "tailwind": {
    "css": "src/styles/globals.css",
    "baseColor": "neutral",
    "cssVariables": true
  },
  "aliases": {
    "components": "@/components",
    "ui": "@/components/ui",
    "utils": "@/lib/utils",
    "hooks": "@/hooks",
    "lib": "@/lib"
  },
  "iconLibrary": "lucide",
  "logic2b": {
    "registry": "https://ui.logic2b.com",
    "version": "1.0.0-rc.16",
    "preset": "bmV1dHJhbHxibHVlfHZpb2xldHx4bHxpbnRlcnxncm90ZXNrfG1vbm98ZGVmYXVsdHxkZWZhdWx0fGRlZmF1bHR8ZGVmYXVsdA"
  }
}